{
  "$schema": "http://json-schema.org/draft-04/schema#",
  "$ref": "#/definitions/object_02",
  "definitions": {
    "object_01": {
      "title": "client",
      "type": "object",
      "required": [
        "firstName",
        "lastName",
        "dob"
      ],
      "additionalProperties": false,
      "properties": {
        "firstName": {
          "type": "string"
        },
        "lastName": {
          "type": "string"
        },
        "dob": {
          "type": "string"
        },
        "offset": {
          "type": "number"
        },
        "type": {
          "type": "string"
        },
        "relationships": {
          "type": "array",
          "title": "relationships",
          "items": {
            "$ref": "#/definitions/object_01"
          }
        }
      }
    },
    "object_02": {
      "type": "object",
      "required": [
        "client",
        "retirementDate",
        "plans",
        "assets"
      ],
      "additionalProperties": false,
      "properties": {
        "client": {
          "$ref": "#/definitions/object_01"
        },
        "retirementDate": {
          "type": "string"
        },
        "plans": {
          "type": "array",
          "title": "plans",
          "items": {
            "type": "object",
            "required": [
              "id",
              "name"
            ],
            "additionalProperties": false,
            "properties": {
              "id": {
                "type": "string"
              },
              "name": {
                "type": "string"
              }
            }
          }
        },
        "assets": {
          "title": "assets",
          "type": "object",
          "required": [
            "cash",
            "stock",
            "insurance"
          ],
          "additionalProperties": false,
          "properties": {
            "cash": {
              "type": "number"
            },
            "stock": {
              "type": "number"
            },
            "insurance": {
              "type": "number"
            }
          }
        }
      }
    }
  }
}